{
  "artifact_uris": [
    "public_mini_reproduction/mini_reproduction_manifest.json"
  ],
  "baseline_policy": "expanded_quality_policy",
  "claim_boundaries": {
    "hallucination_elimination_claimed": false,
    "human_validation": "unsupported",
    "human_validation_claimed": false,
    "official_platform_benchmarking": "unsupported",
    "official_platform_benchmarking_claimed": false,
    "production_readiness": "unsupported",
    "production_readiness_claimed": false,
    "rag_compass_superiority": "unsupported",
    "rag_compass_superiority_claimed": false
  },
  "cost_delta": -1.3,
  "decision": "BLOCK",
  "decision_reason": "finite governance job completed with sanitized public mini reproduction",
  "evidence_support_delta": 0.0,
  "latency_delta": 0.0,
  "quality_delta": -0.008,
  "result_class": "PUBLIC_MINI_REPRODUCTION_FAIL_CLOSED",
  "risk_flags": [],
  "run_id": "public_mini_governance_job",
  "schema_version": "1.0",
  "selected_policy": "risk_guarded_governance",
  "suite": "ragwarrant_cloud_agnostic_governance_job_v1",
  "timestamp_utc": "2026-08-11T22:46:30+00:00",
  "validator_status": "passed"
}
